{
  "id": "dynamic-service-discovery",
  "version": "0.1.0",
  "status": "active",
  "body": ".px/skills/dynamic-service-discovery/SKILL.md",
  "body_sha256": "d14b5999d4836c5c25d38f17e06c505539f74c230fb5ca2bf423612b77483487",
  "references": [],
  "resources": [
    ".px/skills/dynamic-service-discovery/scripts/audit_service_discovery.py"
  ],
  "capability_tags": [
    "service-discovery",
    "dns",
    "identity",
    "cache",
    "network"
  ],
  "effects": [
    "read_local"
  ],
  "provenance": {
    "type": "clean_room",
    "basis": [
      {
        "receipt": "broad-reference-and-code-snapshot",
        "report_sha256": "3b22626a09aa2b00075f86312fcc5080f055cf2d6a0b2817b7ec9fab9a2bec2a"
      },
      {
        "receipt": "control-plane-focus-pass",
        "report_sha256": "a2dd7eeb2c7cd5028e450a285473f01627861b6d8d904524a238c7255bdc3a32"
      },
      {
        "receipt": "tooling-audit-intake-pass",
        "report_sha256": "72d873f6e4268dfba718aa41b31150658774163974ca8335e86080cbf4fa9b39"
      },
      {
        "receipt": "simulation-skill-focus-pass",
        "report_sha256": "4c7bbec98dcccda2066b7b57aeb54530c574ce4c2ee80583ad6c13aaf5816107"
      },
      {
        "receipt": "engineering-skill-focus-pass",
        "report_sha256": "6142489104e2b9e51b8d3a3b16821242c60e7846f52a6d2b42d731a9f7711833"
      }
    ]
  },
  "clean_room": true,
  "tests": "tests/test_capability_mining_skills.py; tests/test_capability_assimilation.py; tests/test_clean_room_capabilities.py",
  "evidence": "tests/test_clean_room_capabilities.py",
  "validation_freshness": "current",
  "context_budget_bytes": 24576
}
