{
  "id": "commission-evidence-first-project",
  "version": "0.1.0",
  "status": "active",
  "body": ".agents/skills/commission-evidence-first-project/SKILL.md",
  "body_sha256": "b8d815891db4740a8d5a28c420f13cedf857418a904093ea987ad5f8e1bee73d",
  "references": [],
  "capability_tags": [
    "commissioning",
    "assumptions",
    "accessibility",
    "risk"
  ],
  "effects": [
    "read_local"
  ],
  "provenance": {
    "type": "clean_room",
    "basis": [
      {
        "path": "skills_bootstrap_stuff/First scan for all tools and deps -.txt",
        "sha256": "92d68096a86f48155ab25e6aa24061a55e43debe1d4816f4b977f23760a972b7"
      },
      {
        "path": "skills_bootstrap_stuff/intakept0.txt",
        "sha256": "aa7d56fe0782b571a61798f3f60c0c292d8db391db0b6631830846eb84d10322"
      },
      {
        "path": "skills_bootstrap_stuff/skeptial engineering.txt",
        "sha256": "d13ff90cf0e2747accf54b65f78e97ab38a3e308c79a819c9e011f2a6c77be6d"
      },
      {
        "path": "skills_bootstrap_stuff/The actual lifecycle I see is.txt",
        "sha256": "efee5005724cc8e7db378730bfbd644a0c08e01c4990ace87fe3f6d5ce2def8f"
      }
    ]
  },
  "clean_room": true,
  "tests": "tests/test_assurance_controls.py",
  "evidence": "tests/test_assurance_controls.py",
  "validation_freshness": "current",
  "context_budget_bytes": 24576
}
