{
  "id": "supervise-contained-execution",
  "version": "0.1.0",
  "status": "active",
  "body": ".agents/skills/supervise-contained-execution/SKILL.md",
  "body_sha256": "18ec489a204669e2eb2392caa73e00432813b88c665e5150688b94fc433eb91e",
  "references": [],
  "capability_tags": [
    "containment",
    "authorization",
    "scope",
    "safety"
  ],
  "effects": [
    "read_local"
  ],
  "provenance": {
    "type": "clean_room",
    "basis": [
      {
        "path": "skills_bootstrap_stuff/First scan for all tools and deps -.txt",
        "sha256": "92d68096a86f48155ab25e6aa24061a55e43debe1d4816f4b977f23760a972b7"
      },
      {
        "path": "skills_bootstrap_stuff/The actual lifecycle I see is.txt",
        "sha256": "efee5005724cc8e7db378730bfbd644a0c08e01c4990ace87fe3f6d5ce2def8f"
      }
    ]
  },
  "clean_room": true,
  "tests": "tests/test_assurance_controls.py",
  "evidence": "tests/test_assurance_controls.py",
  "validation_freshness": "current",
  "context_budget_bytes": 24576
}
