{
  "id": "route-n8n-capabilities",
  "version": "1.0.0",
  "status": "active",
  "body": ".agents/skills/route-n8n-capabilities/SKILL.md",
  "body_sha256": "e2809c14bb2d98c2e70a7de4b1362631f5b9dac47141ab72c146f60f1a72c706",
  "references": [
    ".agents/skills/route-n8n-supabase-stack/references/knowledge/cross-stack/00-architecture.md",
    ".agents/skills/route-n8n-supabase-stack/references/knowledge/cross-stack/01-suggestion-decision-matrix.md",
    ".agents/skills/route-n8n-supabase-stack/references/knowledge/n8n/00-capability-map.md",
    ".agents/skills/route-n8n-supabase-stack/references/knowledge/n8n/01-install-deploy-operate.md",
    ".agents/skills/route-n8n-supabase-stack/references/knowledge/n8n/02-workflow-engineering.md",
    ".agents/skills/route-n8n-supabase-stack/references/knowledge/n8n/03-security-extensions-ai-mcp.md",
    ".agents/skills/route-n8n-supabase-stack/references/knowledge/n8n/04-native-source-findings.md",
    ".agents/skills/route-n8n-supabase-stack/references/knowledge/supabase/00-capability-map.md",
    ".agents/skills/route-n8n-supabase-stack/references/knowledge/supabase/01-cli-local-environments.md",
    ".agents/skills/route-n8n-supabase-stack/references/knowledge/supabase/02-postgres-rls-auth.md",
    ".agents/skills/route-n8n-supabase-stack/references/knowledge/supabase/03-storage-realtime-functions.md",
    ".agents/skills/route-n8n-supabase-stack/references/knowledge/supabase/04-vectors-ai-tools.md"
  ],
  "capability_tags": [
    "capability-selection",
    "n8n",
    "routing",
    "workflow-automation"
  ],
  "effects": [
    "read_local"
  ],
  "provenance": {
    "type": "clean_room_product_capability_synthesis",
    "basis": [
      "evidence/integration/pxi-20260804/candidate_disposition_ledger.json",
      "registry/service_capability_catalog.json"
    ],
    "source_archive_sha256": "e4f79ebab8addfb1db452e4acdf1c5539d8b20a7b9e364cc5183470fee3a9753",
    "source_version": "2.34.0",
    "canonical_owner": ".agents/skills/route-n8n-capabilities/SKILL.md"
  },
  "clean_room": true,
  "tests": "tests/test_service_capability_provider.py",
  "evidence": "tests/test_service_capability_provider.py",
  "validation_freshness": "current",
  "context_budget_bytes": 8192
}
