{
  "id": "test-n8n-supabase-integrations",
  "version": "1.0.0",
  "status": "active",
  "body": ".px/skills/test-n8n-supabase-integrations/SKILL.md",
  "body_sha256": "23c0b549b22743d4347330cc62769c45263d7fd2a57ee4f5108cdd9f7c2a520b",
  "references": [],
  "capability_tags": [
    "cross",
    "e2e",
    "failure-injection",
    "fixtures",
    "rls-tests"
  ],
  "effects": [
    "read_local"
  ],
  "provenance": {
    "type": "clean_room_product_capability_synthesis",
    "basis": [
      "evidence/integration/pxi-20260804/candidate_disposition_ledger.json",
      "registry/service_capability_catalog.json"
    ],
    "source_archive_sha256": "e4f79ebab8addfb1db452e4acdf1c5539d8b20a7b9e364cc5183470fee3a9753",
    "source_version": "2.34.0",
    "canonical_owner": ".px/skills/test-n8n-supabase-integrations/SKILL.md"
  },
  "clean_room": true,
  "tests": "tests/test_service_capability_provider.py",
  "evidence": "tests/test_service_capability_provider.py",
  "validation_freshness": "current",
  "context_budget_bytes": 8192
}
