{
  "id": "govern-memory-fabric",
  "version": "0.2.0",
  "status": "active",
  "body": ".px/skills/govern-memory-fabric/SKILL.md",
  "body_sha256": "77e20d7fdfd55c7cc0f3f6086539ff20fb5984ed8b2451a56adcfa6b760abb8b",
  "references": [
    ".px/skills/govern-memory-fabric/references/memory-contract.md",
    ".px/skills/govern-memory-fabric/references/provider-certification.md",
    ".px/skills/govern-memory-fabric/references/layered-memory-lifecycle.md"
  ],
  "capability_tags": [
    "memory",
    "provenance",
    "isolation",
    "sharding",
    "repair",
    "capture",
    "layered-memory",
    "loadout",
    "context-assembly",
    "offload",
    "evaluation"
  ],
  "effects": [
    "read_local",
    "write_workspace"
  ],
  "provenance": {
    "type": "clean_room_source_synthesis",
    "basis": [
      "registry/project_stream_capabilities.json",
      "runtime/memory_vault.py",
      "runtime/memory_intelligence.py",
      "tests/test_memory_vault.py",
      "tests/test_memory_intelligence.py"
    ]
  },
  "clean_room": true,
  "tests": "tests/test_memory_intelligence.py; tests/test_clean_room_capabilities.py",
  "evidence": "tests/test_clean_room_capabilities.py",
  "validation_freshness": "current",
  "context_budget_bytes": 24576
}
