{
  "id": "self-host-supabase",
  "version": "1.0.0",
  "status": "active",
  "body": ".px/skills/self-host-supabase/SKILL.md",
  "body_sha256": "ea187f08817c7c84bda8b81ed49fb5148ad7d37fdf80e3a2e0cd71a08e594182",
  "references": [],
  "capability_tags": [
    "docker",
    "operations",
    "secrets",
    "self-hosting",
    "supabase"
  ],
  "effects": [
    "install_tool",
    "network",
    "read_local",
    "write_workspace"
  ],
  "provenance": {
    "type": "clean_room_product_capability_synthesis",
    "basis": [
      "evidence/integration/pxi-20260804/candidate_disposition_ledger.json",
      "registry/service_capability_catalog.json"
    ],
    "source_archive_sha256": "e4f79ebab8addfb1db452e4acdf1c5539d8b20a7b9e364cc5183470fee3a9753",
    "source_version": "2.34.0",
    "canonical_owner": ".px/skills/self-host-supabase/SKILL.md"
  },
  "clean_room": true,
  "tests": "tests/test_service_capability_provider.py",
  "evidence": "tests/test_service_capability_provider.py",
  "validation_freshness": "current",
  "context_budget_bytes": 8192
}
